trending_no,video_id,title,publishedat,channelid,channeltitle,categoryid,trending_date,tags,view_count,likes,comment_count
98,kQYoS18YVZQ,Floor 88 x Namie  Kong Kali Kong Official Music Video,2022-10-28,UC8f4o4-Sw2KitQR8MkIkSiw,Rusa Music,Music,22.30.11,rusa|rusa music|rusa marketing|rusamusic|malaysia|malay|melayu|music|muzik|lagu,2213824,35537,1519
99,ZKuhqxTi5Xk,Sometimes the trick IS the treat  halloween shorts,2022-10-31,UCAMPco9PqjBbI_MLsDOO4Jw,American Idol,Entertainment,22.30.11,American Idol|singing competition|Katy Perry|Ryan Seacrest|Luke Bryan|Lionel Richie|covers|sing|ABC|American Idol 2022|auditions|prank|caroline bryan|halloween,17033983,1701064,1495
100,CUQA9xaZde0,DRAMA SPONTAN 20  Episode 3,2022-11-10,UCqWKZzi070JAbB6Adlvn5Qg,Syahmi Sazli,Entertainment,22.30.11,none,353598,12723,1096
101,rE_WtPOJ05s,part 2 TISUE MAG,2022-11-11,UCkqCkyRoXgUxtECdYbQv2cg,Soibahdee Channel,Comedy,22.30.11,none,3860302,172462,559
102,G8og3o5xNjM,BNPH Bertemu Ambil Kira Pandangan Ahli Parlimen BN Pesan Najib MGFlash,2022-11-21,UC-zwAo_0PsviX7-H71mbHYg,MalaysiaGazette TV,News & Politics,22.30.11,malaysiagazette|mgtv|MGNews|MGFlash|MG TV,366602,2826,1369
103,NrURZnqsGtY,Habis hancur kereta Qistina Khaled kena langgar lori Reedzwann cuba tenangkan keadaan,2022-11-02,UCquIzvgQ4PxPDZqFXhuT_gw,MVM MUSIC,Music,22.30.11,mvm|production|music|valley|muzik|lagu|malaysia|malay|melayu,1229440,39342,687
71,2LOL8G1yO6k,minecraft on 1000 ping zombie love curse  monster school minecraft animation shorts,2022-11-09,UC3VBuU-Ywv1qJGXLk05R-Dg,monster school,Film & Animation,22.29.11,школа монстровмонстр школамайнкрафт анимацияшкола мобовmonster schoolminecraft animationшкола майнкрафтмайнкрафт школа монстровшкола монстров в майнкрафтеminecraft challengemonster school minecraftminecraft schoolmonster school animationmonster school funny,22556454,721371,457
80,XuS4usTYvns,episod 06  ninja media sosial  siri animasi mechamato,2022-11-11,UCfqDvjXc2jbAzaeqlIggkkg,monsta,Film & Animation,22.29.11,monsta studiomalayboboiboyvideomovieannouncementbapakbapaccmakgrakakusanniversary13thmenduniacartoonnetworknetflixgsctv3tv9vidioanimationdubmechanizing2022amatotokabamechabotpiandeepmaraayahboboiboymakboboiboyapexseabbbm3filemfilemmelayumoviebaruanimasianimynewglobalherokonchocinemafamilykids moviechildren showdecemberupcomingakan datangsiri animasitgvastroastrogempakastroshawmechamato ep 6,819971,17551,0
104,LIixVuVfXO8,蔡徐坤质疑新游戏规则杨颖周深被李晨吓出表情包 谁才是兄弟团最有飞行天赋的人 奔跑吧共富篇 EP1 FULL 20221104,2022-11-04,UCfj8FsoiPFHn1gZMJaeLEDg,浙江卫视奔跑吧官方频道欢迎订阅,Entertainment,22.30.11,奔跑吧|奔跑吧10|奔跑吧共同富裕|奔跑吧兄弟10|奔跑吧2022|奔跑吧2021|蔡徐坤|周深|Angelababy|郑恺|李晨|沙溢|沙溢蔡徐坤|keeprunning10|跑男10|paonan10|benpaoba10|奔跑吧第六季|running man10|奔跑吧兄弟第十季|奔跑吧10周深|benpaoba|奔跑吧特别季|奔跑吧路透|奔跑吧兄弟|白鹿|魏大勋|陈卓璇|张佳宁|奔跑吧黄河|路透|奔跑吧周深|奔跑吧蔡徐坤|奔跑吧angelababy|奔跑吧沙溢|奔跑吧白鹿|奔跑吧李晨|奔跑吧郑恺|奔跑吧黄河路透|奔跑吧特别季路透|奔跑吧开播|奔跑吧即将开播|奔跑吧预告|林一|王嘉尔|黄旭熙|Lucas|superm|威神v|nct|yuqi|GIDLE|gidle|got7|孙怡|李沁|郭麒麟|宋祖儿|关晓彤鹿晗|迪丽热巴|迪丽热巴鹿晗|姚译添|姚译添宋祖儿|王嘉尔宋雨琦|蔡徐坤白鹿|邓紫棋|奔跑吧共富|共富|屈楚萧|周深光亮|天赐|天赐的声音|特别季|specialseason|沈月|陈哲远|乔欣|张彬彬|张予曦|武林外传|嗨放派|任嘉伦|我们的歌|杨颖|kun,1602544,16601,1134
105,cXGh7q3q0qk,你见过链珠喷泉吗将链珠开头向下一拉竟然就起飞咯科学实验 阿基米吴 这不科学啊,2022-11-06,UCBVcnlsHQxeMMmdrVguWPHQ,MIWU TV,Howto & Style,22.30.11,none,2063379,64066,322
106,9PNpRQYMhas,BUSTING 1000 MYTHS IN 24 HOURS,2022-11-10,UCbp9MyKCTEww4CxEzc_Tp0Q,Stokes Twins,People & Blogs,22.30.11,myths|mythbusters|busting myths|busting 1000 myths|movie myths|busting 100 myths|busting 200 myths|science|Stokes Twins|Ben Azelart|Lexi Rivera|Brent Rivera|Jeremy Hutchins|lexi hensler|pierson|andrew davila|dom brack|sofie dossi|kat hixson|Amp World|amp|David Dobrik|Morgz|MrBeast|logan paul|James Charles|Faze Rug|Alex Warren|Lizzy Capri|Carter Sharer|Preston|unspeakable|airrack|Ryan trahan|preston|Jordan matter|dhar man|sidemen|sam and colby,13005993,394164,30135
107,kIEWJ1ljEro,Joji  Die For You,2022-11-04,UCFl7yKfcRcFmIUbKeCA-SJQ,Joji,Music,22.30.11,joji|joji die for you|joji smithereens|glimpse of us|nectar|in tongues|BALLADS 1|chloe burbank|die for you|joji music video|joji official video|joji live|joji tour|head in the clouds|88rising|blahblahblah demo|1am freestyle|joji night rider|joji dissolve|before the day is over|feeling like the end,18097759,646072,16429
108,_qInmcwIymk,Raden membagikan Hasil Tantangan kepada Rakyat shorts,2022-10-26,UCuJkI-_EJo7PH4bregeHXVA,MNCTV Shorts,Entertainment,22.30.11,mnctv|mnctv official|mnctv shorts,17982045,561863,602
109,Dbs3l_ZJR6o,TREASURE  VolKno MV,2022-11-09,UCx9hXYOCvUYwrprEqe4ZQHA,TREASURE 트레저,Entertainment,22.30.11,YG Entertainment|YG|와이지|Kpop|트레져|트레저|TREASURE|CHOI HYUN SUK|JIHOON|YOSHI|JUNKYU|MASHIHO|YOON JAE HYUK|ASAHI|BANG YE DAM|DOYOUNG|HARUTO|PARK JEONG WOO|SO JUNG HWAN|최현석|지훈|요시|준규|마시호|윤재혁|아사히|방예담|도영|하루토|박정우|소정환|TREASURE THE SECOND STEP|THE SECOND STEP|TREASURE 직진|TREASURE JIKJIN|JIKJIN|직진|트레저 직진,18782072,477901,34672
110,H8nERjGhpPk,黃明志的中東情歌卡達世界盃2022主題曲Ya GamilaFt Yasin Sulaiman 高清無碼 2022 HD  Uncensored,2022-11-04,UCFUtqTcgJgRnmZ3tMU6P74Q,Namewee,Entertainment,22.30.11,Namewee|黃明志|World Cup|Qatar|2022|كأس العالم|Theme Song|Doha|Football|Soccer|Assalamualaikum Ya Gamila|Ya Gamila|Ya Jamila|Fifa|卡達|世界杯|足球|Arab Song|Arabic Song|世界盃|卡塔尔|卡塔尔世界杯|世界杯主題曲,4008573,47354,3179
111,I0LpHLJGBoc,The perfect dotted circle ,2022-11-03,UCoGForHQAmk0_9rI9CABeYw,Woody  Kleiny,Entertainment,22.30.11,none,103774680,5366322,5610
112,q_wlOxoFyOE,keset mana,2022-11-16,UC7NjHQFW-iD0nZy2javtbsA,WILSON SINAI,Comedy,22.30.11,Wilson Sinai|kocak|lucu|humor|dagelan|wilsonsinai|wilson|vidgram,4534956,72916,96
113,6MbWW_2sFPI,Insomniacks  Igauan Malam Official Lyric Video,2022-11-04,UC-2a-EcwmRUaAOVRR8jM2zQ,InsomniacksMYVEVO,Music,22.30.11,Insomniacks|Igauan|Malam|Lyric|Video|Universal|Music|Ltd|Malaysia|branch|Pop,391926,11086,320
114,ixllGOX0Evw,GOD OF WAR RAGNAROK Gameplay Walkthrough FULL GAME PS5 4K 60FPS No Commentary,2022-11-08,UCj4lFy4F5PqXD7d41mCKVYw,GameClips,Gaming,22.30.11,God Of War Ragnarok|God Of War Ragnarok Gameplay|God Of War Ragnarok Walkthrough|God Of War Ragnarok Walkthrough Part 1|God Of War Ragnarok Full Game|God Of War Ragnarok PS5|God Of War Ragnarok No Commentary|God Of War Ragnarok PS5 Gameplay|Kratos|PS5|PS5 Gameplay|4K|4K Gameplay|No Commentary|No|Commentary|Gameplay|Walkthrough|Playstation 5|Xbox Series X|PC|Full|Game,5970775,95431,5614
115,PyvXZ7o8Xv0,When Cristiano Ronaldo and Portugal did the Mannequin Challenge ,2022-10-26,UC6c1z7bA__85CIWZ_jpCK-Q,ESPN FC,Sports,22.30.11,espn fc|soccer on espn|espn soccer|ESPNFC|ESPNFC|ESPN FC|espn fc tv|soccer|futbol|When Cristiano Ronaldo and Portugal did the Mannequin Challenge |cristiano ronaldo|ronaldo|cristiano ronaldo world cup|cristiano ronaldo flex|ronaldo flex|ronaldo portugal|world cup 2022|shorts|shortsvideo|espn fc shorts|espnfc shorts|manchester united,38299531,2083310,5594
116,WOakSm34QHk,NGINTIP FROST DIAMOND PACARAN PAKAI DRONE TERNYATA MOJOK DI DEKAT RUMAH KOSONG DIA MALAH,2022-11-08,UC4hGmH5sABOA70D4fGb8qNQ,Frost Diamond,Entertainment,22.30.11,Frost|Diamond|Tutorial|Minecraft|Cewek|Pacaran,2530303,44451,1105
117,lM1P2JwZ5jE,Total surprise  Share yours with  TSAntiHeroChallenge brought to you by YouTube Shorts,2022-11-01,UCqECaJ8Gagnn7YCbPEzWH6g,Taylor Swift,Music,22.30.11,none,73899421,3181600,20591
118,tNaIbwvL1Ko,Minecraft but Rainbow Friends Beat the Game for you,2022-11-10,UCKGNVB2moP-zeAWPmw8HvAA,Craftee,Gaming,22.30.11,minecraft|minecraft but|new minecraft|craftee|craft|crafter|crafty|crafting|crafting recipe|crafting in minecraft|minecraft update|survival|how to survive|caves and cliffs|caves and cliffs update|new minecraft channel|diamonds|ender dragon|fastest diamonds|custom|diamond|emeralds|minecraft survival|minecraft challenge|minecraft secret|minecraft mod|minecraft rainbow friends|minecraft rainbow friends mod|minecraft but rainbow friends,4723846,66153,1829
119,x8IqYK9lf_M,Semua pimpinan Umno termasuk saya kena letak jawatan bukan Zahid saja,2022-11-20,UC9ULnkwvyofZ_sWrzRpyvrg,KiniTV,News & Politics,22.30.11,kinitv|malaysia|politics,417496,2301,1162
35,jmww_DEbzVs,bahagian 2 bermula disember iniejen ali musim 3 bahagian 2  official teaser,2022-11-25,UC42ZduLx6o3Nqg04kMuMCEw,ejenali,Film & Animation,22.29.11,ejenalianimationmyboboiboyupin ipinwauwauanimationpwsprimeworksejenanimasikartunlescopaquemonstaanimonstaalibakarcomot,196527,8270,922
37,-YrOEmbwe_s,yonimoshorts shorts,2022-10-28,UCmrfD0X_7eRDoHqOKakbREQ,elephant movie,Film & Animation,22.29.11,filmmoviefilmsshortselephant moviewatch elephant movieelephant movie youtubeshort filmsenglish moviemoviesfree short filmbest scenesmovie clipsbest momentsscience fictionfree scifi shortsci fi shortsscifiactionbest action moviesaction movieaction moviesfeatureyonimofantasy,12409420,1035210,1136
86,U4p_baZbipA,episod 05  jangan cari pasal dengan janitoor  siri animasi mechamato,2022-11-04,UCfqDvjXc2jbAzaeqlIggkkg,monsta,Film & Animation,22.29.11,monsta studiomalayboboiboyvideomovieannouncementbapakbapaccmakgrakakusanniversary13thmenduniacartoonnetworknetflixgsctv3tv9vidioanimationdubmechanizing2022amatotokabamechabotpiandeepmaraayahboboiboymakboboiboyapexseabbbm3filemfilemmelayumoviebaruanimasianimynewglobalherokonchocinemafamilykids moviechildren showdecemberupcomingakan datangsiri animasitgvastroastrogempakastroshaw,1196357,22701,0
5,Jm29kLeWqDA,jung kook from bts performs dreamers at fifa world cup opening ceremony,2022-11-20,UCpcTrCXblq78GZrTUTLWeBw,fifa,Music,22.29.11,jung cookbtskpopkpopfifa world cupfifa world cup opening ceremonyqatar opening ceremonydreamersjung cook dreamersjung cook at world cup opening ceremonyjung cook performs dreamersfahad al kubaisifahad al kubaisi dreamers,31765355,1661068,69558
7,jEdfjuG0Fx4,정국 jung kook dreamers  fifa world cup qatar 2022 opening ceremony,2022-11-21,UCLkAepWjdylmXSltofFvsYQ,bangtantv,Music,22.29.11,방탄소년단btsbangtan알엠rm슈가suga제이홉jhope지민정국kpop방탄jhopejung kookjiminbts vjin,42770760,2585617,98715
9,Ut1OzEVUiM4,red velvet 레드벨벳 birthday mv,2022-11-28,UCEf_Bc-KVd7onSeifS3py9g,smtown,Music,22.29.11,레드벨벳벌쓰데이벌스데이생일아이린슬기예리웬디조이뮤직비디오뮤비red velvetbirthdayireneseulgiyeriwendyjoypartymusic videomvthe reve festival리브 페스티벌,5172671,571842,27738
31,1iWTl8DM7Rg,maher zain  humood  tahayya  world cup 2022  ماهر زين و حمود الخضر  تهيا,2022-11-23,UCBq5hp6DvwWam2XOXw6lYJA,awakening music,Music,22.29.11,world cup songworld cup song 2022maher zainmaher zain songshumoodماهر زينqatar world cup songاغنية كاس العالم 2022world cup musicحمود الخضرmaher zain world cuphumood world cupmaher zain newتهياtahayyaماهر زين وحمود الخضرهيا هيا كاس العالمتهيأ حمود الخضرهيا هياhayya hayyaحمود الخضر وماهر زين2022 fifa world cupfifa 2022 songاغاني كاس العالم قطر 2022tahayya maher zainحمود الخضر كاس العالماغانيfifa world cup 2022 song,12570980,281433,16599
45,zuVV9Y55gvc,ranjithame  varisu lyric song tamil  thalapathy vijay  rashmika  vamshi paidipally  thaman s,2022-11-05,UCq-Fj5jknLsUf-MWSy4_brA,tseries,Music,22.29.11,hindi songs 2022hindi songs newbollywood songs 2022bollywood movies 2022tseriestseries songshindi songsbollywood romantic songsromantic hindi songsbollywood dance songsranjithame lyricalvarisuthalapathy vijay singingthalapathy vijay songthalapathy vijay dance numberthalapathy vijay ranjithamethalapathy vijay varisuthalapathy vijayvivekthaman svarisu lyric song tamilranjithame lyric songranjithame video songranjithametamil song,74022679,2011707,90720
104,lM1P2JwZ5jE,total surprise  share yours with  tsantiherochallenge brought to you by youtube shorts,2022-11-01,UCqECaJ8Gagnn7YCbPEzWH6g,taylor swift,Music,22.29.11,none,73869556,3178835,20598
112,JA7DYU5OXfM,japanese alphabet song is way too good bro shorts,2022-10-28,UCnTB8uNxND40iwvPiyzpnWw,heiakim,Music,22.29.11,heiakimharrycitradiharry citradiheiakim music,12188980,1167313,13989
2,IwzkfMmNMpM,정국 jung kook of bts featuring fahad al kubaisi  dreamers  fifa world cup 2022 soundtrack,2022-11-22,UCpcTrCXblq78GZrTUTLWeBw,fifa,Sports,22.29.11,kpopjung cookdreamersdreamers kpopdreamer btsjung cook world cupjung cook fifa songjung cook world cup songworld cup song,38919619,3306720,168917
11,pqNFeoV8RlY,bruno fernandes cross flies past cristiano ronaldos head and into the net vs uruguay,2022-11-28,UCpcTrCXblq78GZrTUTLWeBw,fifa,Sports,22.29.11,none,1320977,58717,1405
12,xktdFsBcUQY,neymar made that look too easy,2022-11-17,UC6c1z7bA__85CIWZ_jpCK-Q,espn fc,Sports,22.29.11,espn fcsoccer on espnespn soccerespnfcespnfcespn fcespn fc tvsoccerfutbolneymar made that look too easy neymarneymar jrespn fc shortsespnfc shortsshortsshortsvideoworld cupworld cup 2022,20310268,994799,3058
17,wHKsNi1uEK0,brazil 1  0 switzerland  world cup 2022 highlights  group g  sebolasuara,2022-11-28,UC3nsS1zgb4Jye9kmA45K6Yg,stadium astro,Sports,22.29.11,stadium astrosportsastro,707186,9001,350
19,10ov86esl28,south korea 2  3 ghana  world cup 2022 highlights  group h  sebolasuara,2022-11-28,UC3nsS1zgb4Jye9kmA45K6Yg,stadium astro,Sports,22.29.11,stadium astrosportsastro,579386,6226,589
100,PyvXZ7o8Xv0,when cristiano ronaldo and portugal did the mannequin challenge,2022-10-26,UC6c1z7bA__85CIWZ_jpCK-Q,espn fc,Sports,22.29.11,espn fcsoccer on espnespn soccerespnfcespnfcespn fcespn fc tvsoccerfutbolwhen cristiano ronaldo and portugal did the mannequin challenge cristiano ronaldoronaldocristiano ronaldo world cupcristiano ronaldo flexronaldo flexronaldo portugalworld cup 2022shortsshortsvideoespn fc shortsespnfc shortsmanchester united,35371242,1953748,5312
67,LUzI9Jk929A,if people rode dinosaurs instead of walked,2022-10-25,UCb8vrqP8Z7Oz9ZTYvUtjUHQ,daniel labelle,Comedy,22.29.11,none,117465233,5182046,10249
28,PMT3UhzDxH4,白鹿周深的生日惊喜变惊吓蔡徐坤 的蔡式速记法有多绝周深姚译添的mbti首次揭露 陈卓璇符龙飞新歌舞台首发奔跑吧共富篇 keeprunning ep3 full 20221118,2022-11-18,UCfj8FsoiPFHn1gZMJaeLEDg,浙江卫视奔跑吧官方频道欢迎订阅,Entertainment,22.29.11,奔跑吧奔跑吧共同富裕奔跑吧10奔跑吧10ep1奔跑吧兄弟10奔跑吧2022奔跑吧2021蔡徐坤周深angelababy郑恺李晨沙溢沙溢蔡徐坤keeprunning10跑男10paonan10benpaoba10奔跑吧第六季running man10奔跑吧兄弟第十季奔跑吧10周深benpaoba奔跑吧特别季奔跑吧路透奔跑吧兄弟白鹿魏大勋陈卓璇张佳宁奔跑吧黄河路透奔跑吧周深奔跑吧蔡徐坤奔跑吧angelababy奔跑吧沙溢奔跑吧白鹿奔跑吧李晨奔跑吧郑恺奔跑吧黄河路透奔跑吧特别季路透奔跑吧开播奔跑吧即将开播奔跑吧预告林一王嘉尔黄旭熙lucassuperm威神vnctyuqigidlegidlegot7孙怡李沁郭麒麟宋祖儿关晓彤鹿晗迪丽热巴迪丽热巴鹿晗姚译添姚译添宋祖儿王嘉尔宋雨琦蔡徐坤白鹿邓紫棋符龙飞音乐舞台生日music檀健次共富陈飞宇阿瑟朱韵罗云熙硬糖少女hi6希林希林娜依高最美中轴线白鹿生日周深生日mbti,922955,8427,487
42,FD-0KG-h2-c,gordon ramsay tries most expensive chocolate bar,2022-11-19,UCX6OQ3DkcsbYNE6H8uQQuVA,mrbeast,Entertainment,22.29.11,none,34846802,2921090,10088
46,3xReIHV13IQ,she really did it her way,2022-11-14,UCSWwb_YyNB8vuC1VDcfPPaQ,talent recap,Entertainment,22.29.11,agt 2022agtagt videosagt auditionsamericas got talentbgtbgt videosbgt auditionsbritains got talentsimon cowellgot talentgolden buzzertop actsbest auditionsangelica haledarci lynneindiaphilippines,25722922,1710117,3787
54,39B8qBta-zk,rolling pigs from the kayak,2022-11-10,UCI7bNyuDVBUnacJb85WlUSg,hunting with stu,Entertainment,22.29.11,none,12183172,134051,600
55,aNlk-aujf3o,live gegar vaganza 9 live   minggu separuh akhir,2022-11-20,UCfztuMBrL9F-KqLZk_SY9TA,astro gempak,Entertainment,22.29.11,astro gempak,488708,1811,207
56,HSX8Lts4enc,bocil kembar selalu dirawat sama nenek gemoy  kaleb andri shorts alurfilm storytelling,2022-11-14,UCskgi2HFEUjB0mXU_IBXOrg,kaleb andri,Entertainment,22.29.11,none,4347684,360152,6147
57,Qyf4sJKayBc,magician  food,2022-11-11,UC3IjgjgWtpLTCrR0shGXKVg,seandoesmagic,Entertainment,22.29.11,none,47504027,1469924,7337
59,kYoJ9J9kPSA,genius level escape method l tiktok creative humor video lfunny video long momshorts,2022-10-29,UCobCsXaWsPawN22tXWH0cbw,guige,Entertainment,22.29.11,tiktokcreativecreative craft创意funny搞笑amazingskillstalenttalent peopleviral videostiktoksplot twistshumor幽默familymom and sondetective momdetective mom vs genius sonpranks fat daughter20212022newvideostik toktry not to laugh challengefunniest momentscomedy videospani videomust watch new year funny videocompilationescapeescape momangry mom,158622186,4129825,3340
68,hbgxLp4oRfE,cool hair prank  shorts,2022-11-10,UCeYTfGpNCmVhlxjQxBDrGPA,mr degree,Entertainment,22.29.11,funnyhairprankpranksschoolmarianamr degreeshortsgirlcoolbesttricktricks,51056948,1861545,2663
69,08m8FwQNXec,兄弟团自费秋游团建 谁将是最后的胜利者秋天的微风与稻田就是绝配快来和奔奔一起乘坐浪漫热气球 奔跑吧共富篇 keeprunning ep2 full 20221111,2022-11-11,UCfj8FsoiPFHn1gZMJaeLEDg,浙江卫视奔跑吧官方频道欢迎订阅,Entertainment,22.29.11,奔跑吧奔跑吧共同富裕奔跑吧10奔跑吧10ep1奔跑吧兄弟10奔跑吧2022奔跑吧2021蔡徐坤周深angelababy郑恺李晨沙溢沙溢蔡徐坤keeprunning10跑男10paonan10benpaoba10奔跑吧第六季running man10奔跑吧兄弟第十季奔跑吧10周深benpaoba奔跑吧特别季奔跑吧路透奔跑吧兄弟白鹿魏大勋陈卓璇张佳宁奔跑吧黄河路透奔跑吧周深奔跑吧蔡徐坤奔跑吧angelababy奔跑吧沙溢奔跑吧白鹿奔跑吧李晨奔跑吧郑恺奔跑吧黄河路透奔跑吧特别季路透奔跑吧开播奔跑吧即将开播奔跑吧预告林一王嘉尔黄旭熙lucassuperm威神vnctyuqigidlegidlegot7孙怡李沁郭麒麟宋祖儿关晓彤鹿晗迪丽热巴迪丽热巴鹿晗姚译添姚译添宋祖儿王嘉尔宋雨琦蔡徐坤白鹿邓紫棋孙怡 董子健董子健 孙怡孙怡 董子健 知乎mangotv 再见爱人再见爱人2 花絮再见爱人 第二季再见爱人,1022228,9791,637
72,kX3nB4PpJko,last to take hand off jet keeps it,2022-11-12,UCX6OQ3DkcsbYNE6H8uQQuVA,mrbeast,Entertainment,22.29.11,none,61774178,2679246,93267
73,yUjn3Aynq6Q,女孩出事 竟然惊动黑白两道大人物 ohoou thepenaltyzone shorts,2022-11-08,UCK73Yh0cVnfyDf9Y63YeBPQ,cctv热播剧场,Entertainment,22.29.11,黑白禁区扫黑风暴黑白禁区整片直播黑白禁区直播黑白禁区完整版黑白禁区 全集欧豪刘晓洁徐洪浩李乃文傅程鹏杜源电视剧 黑白禁区卧底警察国产剧缉毒毒品毒枭破冰行动惊心动魄正义邪恶失忆灰色地带小说刑侦剧情最新电视剧电视剧直播2021电视剧热播电视剧,1010856,46580,79
76,YlvcFJOE-OE,giving iphones instead of candy on halloween,2022-11-02,UCX6OQ3DkcsbYNE6H8uQQuVA,mrbeast,Entertainment,22.29.11,none,139668683,7194972,39731
91,LIixVuVfXO8,蔡徐坤质疑新游戏规则杨颖周深被李晨吓出表情包 谁才是兄弟团最有飞行天赋的人 奔跑吧共富篇 ep1 full 20221104,2022-11-04,UCfj8FsoiPFHn1gZMJaeLEDg,浙江卫视奔跑吧官方频道欢迎订阅,Entertainment,22.29.11,奔跑吧奔跑吧10奔跑吧共同富裕奔跑吧兄弟10奔跑吧2022奔跑吧2021蔡徐坤周深angelababy郑恺李晨沙溢沙溢蔡徐坤keeprunning10跑男10paonan10benpaoba10奔跑吧第六季running man10奔跑吧兄弟第十季奔跑吧10周深benpaoba奔跑吧特别季奔跑吧路透奔跑吧兄弟白鹿魏大勋陈卓璇张佳宁奔跑吧黄河路透奔跑吧周深奔跑吧蔡徐坤奔跑吧angelababy奔跑吧沙溢奔跑吧白鹿奔跑吧李晨奔跑吧郑恺奔跑吧黄河路透奔跑吧特别季路透奔跑吧开播奔跑吧即将开播奔跑吧预告林一王嘉尔黄旭熙lucassuperm威神vnctyuqigidlegidlegot7孙怡李沁郭麒麟宋祖儿关晓彤鹿晗迪丽热巴迪丽热巴鹿晗姚译添姚译添宋祖儿王嘉尔宋雨琦蔡徐坤白鹿邓紫棋奔跑吧共富共富屈楚萧周深光亮天赐天赐的声音特别季specialseason沈月陈哲远乔欣张彬彬张予曦武林外传嗨放派任嘉伦我们的歌杨颖kun,1593193,16557,1131
94,_qInmcwIymk,raden membagikan hasil tantangan kepada rakyat shorts,2022-10-26,UCuJkI-_EJo7PH4bregeHXVA,mnctv shorts,Entertainment,22.29.11,mnctvmnctv officialmnctv shorts,17849174,558091,599
95,Dbs3l_ZJR6o,treasure  volkno mv,2022-11-09,UCx9hXYOCvUYwrprEqe4ZQHA,treasure 트레저,Entertainment,22.29.11,yg entertainmentyg와이지kpop트레져트레저treasurechoi hyun sukjihoonyoshijunkyumashihoyoon jae hyukasahibang ye damdoyoungharutopark jeong wooso jung hwan최현석지훈요시준규마시호윤재혁아사히방예담도영하루토박정우소정환treasure the second stepthe second steptreasure 직진treasure jikjinjikjin직진트레저 직진,18745863,476663,34590
97,H8nERjGhpPk,黃明志的中東情歌卡達世界盃2022主題曲ya gamilaft yasin sulaiman 高清無碼 2022 hd  uncensored,2022-11-04,UCFUtqTcgJgRnmZ3tMU6P74Q,namewee,Entertainment,22.29.11,namewee黃明志world cupqatar2022كأس العالمtheme songdohafootballsoccerassalamualaikum ya gamilaya gamilaya jamilafifa卡達世界杯足球arab songarabic song世界盃卡塔尔卡塔尔世界杯世界杯主題曲,3989208,46939,3160
